<?xml version="1.0" standalone="no"?>
<!DOCTYPE entity PUBLIC "-//UC Berkeley//DTD MoML 1//EN"
    "http://ptolemy.eecs.berkeley.edu/xml/dtd/MoML_1.dtd">
<entity name="Const" class="ptolemy.actor.TypedCompositeActor">
    <property name="_createdBy" class="ptolemy.kernel.attributes.VersionAttribute" value="7.2.devel">
    </property>
    <property name="_windowProperties" class="ptolemy.actor.gui.WindowPropertiesAttribute" value="{bounds={89, 65, 815, 507}, maximized=false}">
    </property>
    <property name="_vergilSize" class="ptolemy.actor.gui.SizeAttribute" value="[600, 400]">
    </property>
    <property name="_vergilZoomFactor" class="ptolemy.data.expr.ExpertParameter" value="1.0">
    </property>
    <property name="_vergilCenter" class="ptolemy.data.expr.ExpertParameter" value="{300.0, 200.0}">
    </property>
    <property name="SDF Director" class="ptolemy.domains.sdf.kernel.SDFDirector">
        <property name="iterations" class="ptolemy.data.expr.Parameter" value="10">
        </property>
        <property name="_location" class="ptolemy.kernel.util.Location" value="[95.0, 60.0]">
        </property>
    </property>
    <property name="JavaCodeGenerator" class="ptolemy.codegen.java.kernel.JavaCodeGenerator">
        <property name="_location" class="ptolemy.kernel.util.Location" value="{470.0, 85.0}">
        </property>
    </property>
    <entity name="Test" class="ptolemy.actor.lib.Test">
        <property name="correctValues" class="ptolemy.data.expr.Parameter" value="{{&quot;true&quot;, &quot;1&quot;, &quot;true&quot;, &quot;1&quot;, &quot;1.23&quot;}, {&quot;true&quot;, &quot;1&quot;, &quot;true&quot;, &quot;1&quot;, &quot;1.23&quot;}, {&quot;true&quot;, &quot;1&quot;, &quot;true&quot;, &quot;1&quot;, &quot;1.23&quot;}, {&quot;true&quot;, &quot;1&quot;, &quot;true&quot;, &quot;1&quot;, &quot;1.23&quot;}, {&quot;true&quot;, &quot;1&quot;, &quot;true&quot;, &quot;1&quot;, &quot;1.23&quot;}, {&quot;true&quot;, &quot;1&quot;, &quot;true&quot;, &quot;1&quot;, &quot;1.23&quot;}, {&quot;true&quot;, &quot;1&quot;, &quot;true&quot;, &quot;1&quot;, &quot;1.23&quot;}, {&quot;true&quot;, &quot;1&quot;, &quot;true&quot;, &quot;1&quot;, &quot;1.23&quot;}, {&quot;true&quot;, &quot;1&quot;, &quot;true&quot;, &quot;1&quot;, &quot;1.23&quot;}, {&quot;true&quot;, &quot;1&quot;, &quot;true&quot;, &quot;1&quot;, &quot;1.23&quot;}}">
        </property>
        <property name="trainingMode" class="ptolemy.actor.parameters.SharedParameter" value="false">
        </property>
        <property name="_location" class="ptolemy.kernel.util.Location" value="[365.0, 295.0]">
        </property>
    </entity>
    <entity name="Const7" class="ptolemy.actor.lib.Const">
        <property name="value" class="ptolemy.data.expr.Parameter" value="1.23">
        </property>
        <doc>Create a constant sequence.</doc>
        <property name="_icon" class="ptolemy.vergil.icon.BoxedValueIcon">
            <property name="attributeName" class="ptolemy.kernel.util.StringAttribute" value="value">
            </property>
            <property name="displayWidth" class="ptolemy.data.expr.Parameter" value="60">
            </property>
        </property>
        <property name="_location" class="ptolemy.kernel.util.Location" value="[90.0, 315.0]">
        </property>
    </entity>
    <entity name="Const6" class="ptolemy.actor.lib.Const">
        <property name="value" class="ptolemy.data.expr.Parameter" value="&quot;true&quot;">
        </property>
        <doc>Create a constant sequence.</doc>
        <property name="_icon" class="ptolemy.vergil.icon.BoxedValueIcon">
            <property name="attributeName" class="ptolemy.kernel.util.StringAttribute" value="value">
            </property>
            <property name="displayWidth" class="ptolemy.data.expr.Parameter" value="60">
            </property>
        </property>
        <property name="_location" class="ptolemy.kernel.util.Location" value="[100.0, 125.0]">
        </property>
    </entity>
    <entity name="Const5" class="ptolemy.actor.lib.Const">
        <property name="value" class="ptolemy.data.expr.Parameter" value="true">
        </property>
        <doc>Create a constant sequence.</doc>
        <property name="_icon" class="ptolemy.vergil.icon.BoxedValueIcon">
            <property name="attributeName" class="ptolemy.kernel.util.StringAttribute" value="value">
            </property>
            <property name="displayWidth" class="ptolemy.data.expr.Parameter" value="60">
            </property>
        </property>
        <property name="_location" class="ptolemy.kernel.util.Location" value="[90.0, 370.0]">
        </property>
    </entity>
    <entity name="Const4" class="ptolemy.actor.lib.Const">
        <property name="value" class="ptolemy.data.expr.Parameter" value="&quot;1&quot;">
        </property>
        <doc>Create a constant sequence.</doc>
        <property name="_icon" class="ptolemy.vergil.icon.BoxedValueIcon">
            <property name="attributeName" class="ptolemy.kernel.util.StringAttribute" value="value">
            </property>
            <property name="displayWidth" class="ptolemy.data.expr.Parameter" value="60">
            </property>
        </property>
        <property name="_location" class="ptolemy.kernel.util.Location" value="[95.0, 265.0]">
        </property>
    </entity>
    <entity name="Const3" class="ptolemy.actor.lib.Const">
        <property name="value" class="ptolemy.data.expr.Parameter" value="1">
        </property>
        <doc>Create a constant sequence.</doc>
        <property name="_icon" class="ptolemy.vergil.icon.BoxedValueIcon">
            <property name="attributeName" class="ptolemy.kernel.util.StringAttribute" value="value">
            </property>
            <property name="displayWidth" class="ptolemy.data.expr.Parameter" value="60">
            </property>
        </property>
        <property name="_location" class="ptolemy.kernel.util.Location" value="[100.0, 215.0]">
        </property>
    </entity>
    <relation name="relation" class="ptolemy.actor.TypedIORelation">
        <property name="width" class="ptolemy.data.expr.Parameter" value="1">
        </property>
    </relation>
    <relation name="relation4" class="ptolemy.actor.TypedIORelation">
        <property name="width" class="ptolemy.data.expr.Parameter" value="1">
        </property>
    </relation>
    <relation name="relation6" class="ptolemy.actor.TypedIORelation">
        <property name="width" class="ptolemy.data.expr.Parameter" value="1">
        </property>
    </relation>
    <relation name="relation2" class="ptolemy.actor.TypedIORelation">
        <property name="width" class="ptolemy.data.expr.Parameter" value="1">
        </property>
    </relation>
    <relation name="relation3" class="ptolemy.actor.TypedIORelation">
        <property name="width" class="ptolemy.data.expr.Parameter" value="1">
        </property>
    </relation>
    <link port="Test.input" relation="relation"/>
    <link port="Test.input" relation="relation4"/>
    <link port="Test.input" relation="relation6"/>
    <link port="Test.input" relation="relation2"/>
    <link port="Test.input" relation="relation3"/>
    <link port="Const7.output" relation="relation3"/>
    <link port="Const6.output" relation="relation"/>
    <link port="Const5.output" relation="relation6"/>
    <link port="Const4.output" relation="relation4"/>
    <link port="Const3.output" relation="relation2"/>
</entity>
