<?xml version="1.0" standalone="no"?>
<!DOCTYPE entity PUBLIC "-//UC Berkeley//DTD MoML 1//EN"
    "http://ptolemy.eecs.berkeley.edu/xml/dtd/MoML_1.dtd">
<entity name="ExpressionFix3" class="ptolemy.actor.TypedCompositeActor">
    <property name="_createdBy" class="ptolemy.kernel.attributes.VersionAttribute" value="6.0-devel">
    </property>
    <property name="_vergilSize" class="ptolemy.actor.gui.SizeAttribute" value="[600, 400]">
    </property>
    <property name="_vergilLocation" class="ptolemy.actor.gui.LocationAttribute" value="[104, 127]">
    </property>
    <property name="SDF Director" class="ptolemy.domains.sdf.kernel.SDFDirector">
        <property name="iterations" class="ptolemy.data.expr.Parameter" value="5">
        </property>
        <property name="vectorizationFactor" class="ptolemy.data.expr.Parameter" value="1">
        </property>
        <property name="allowDisconnectedGraphs" class="ptolemy.data.expr.Parameter" value="false">
        </property>
        <property name="allowRateChanges" class="ptolemy.data.expr.Parameter" value="false">
        </property>
        <property name="_location" class="ptolemy.kernel.util.Location" value="85.0, 55.0">
        </property>
    </property>
    <property name="_windowProperties" class="ptolemy.actor.gui.WindowPropertiesAttribute" value="{bounds={104, 129, 815, 518}, maximized=false}">
    </property>
    <property name="_vergilZoomFactor" class="ptolemy.data.expr.ExpertParameter" value="1.0">
    </property>
    <property name="_vergilCenter" class="ptolemy.data.expr.ExpertParameter" value="{300.0, 200.0}">
    </property>
    <entity name="SampleDelay" class="ptolemy.domains.sdf.lib.SampleDelay">
        <property name="initialOutputs" class="ptolemy.data.expr.Parameter" value="{fix(0.0,8,4)}">
        </property>
        <property name="_icon" class="ptolemy.vergil.icon.BoxedValueIcon">
            <property name="attributeName" class="ptolemy.kernel.util.StringAttribute" value="initialOutputs">
            </property>
            <property name="displayWidth" class="ptolemy.data.expr.Parameter" value="20">
            </property>
        </property>
        <property name="_location" class="ptolemy.kernel.util.Location" value="[105.0, 315.0]">
        </property>
        <property name="_flipPortsHorizontal" class="ptolemy.data.expr.Parameter" value="true">
        </property>
        <port name="output" class="ptolemy.actor.TypedIOPort">
            <property name="output"/>
            <property name="_type" class="ptolemy.actor.TypeAttribute" value="unknown">
            </property>
        </port>
    </entity>
    <entity name="Expression5" class="ptolemy.actor.lib.Expression">
        <property name="expression" class="ptolemy.kernel.util.StringAttribute" value="fix(1.0,8,4) + input">
        </property>
        <property name="_icon" class="ptolemy.vergil.icon.BoxedValueIcon">
            <property name="attributeName" class="ptolemy.kernel.util.StringAttribute" value="expression">
            </property>
            <property name="displayWidth" class="ptolemy.data.expr.Parameter" value="60">
            </property>
        </property>
        <property name="_location" class="ptolemy.kernel.util.Location" value="[125.0, 230.0]">
        </property>
        <port name="input" class="ptolemy.actor.TypedIOPort">
            <property name="input"/>
        </port>
    </entity>
    <entity name="FixToFix" class="ptolemy.actor.lib.conversions.FixToFix">
        <property name="precision" class="ptolemy.data.expr.Parameter" value="[8, 4]">
        </property>
        <property name="overflow" class="ptolemy.kernel.util.StringAttribute" value="saturate">
            <property name="style" class="ptolemy.actor.gui.style.ChoiceStyle">
                <property name="saturate" class="ptolemy.kernel.util.StringAttribute" value="saturate">
                </property>
                <property name="overflow_to_zero" class="ptolemy.kernel.util.StringAttribute" value="overflow_to_zero">
                </property>
            </property>
        </property>
        <property name="quantization" class="ptolemy.kernel.util.Attribute">
            <property name="style" class="ptolemy.actor.gui.style.ChoiceStyle">
                <property name="round" class="ptolemy.kernel.util.StringAttribute" value="round">
                </property>
                <property name="truncate" class="ptolemy.kernel.util.StringAttribute" value="truncate">
                </property>
            </property>
        </property>
        <property name="_location" class="ptolemy.kernel.util.Location" value="[225.0, 230.0]">
        </property>
    </entity>
    <relation name="relation6" class="ptolemy.actor.TypedIORelation">
        <property name="width" class="ptolemy.data.expr.Parameter" value="1">
        </property>
        <vertex name="vertex1" value="[55.0, 260.0]">
        </vertex>
    </relation>
    <relation name="relation" class="ptolemy.actor.TypedIORelation">
        <property name="width" class="ptolemy.data.expr.Parameter" value="1">
        </property>
    </relation>
    <relation name="relation2" class="ptolemy.actor.TypedIORelation">
        <property name="width" class="ptolemy.data.expr.Parameter" value="1">
        </property>
    </relation>
    <link port="SampleDelay.input" relation="relation"/>
    <link port="SampleDelay.output" relation="relation6"/>
    <link port="Expression5.output" relation="relation2"/>
    <link port="Expression5.input" relation="relation6"/>
    <link port="FixToFix.input" relation="relation2"/>
    <link port="FixToFix.output" relation="relation"/>
</entity>
