<?xml version="1.0" standalone="no"?>
<!DOCTYPE entity PUBLIC "-//UC Berkeley//DTD MoML 1//EN"
    "http://ptolemy.eecs.berkeley.edu/xml/dtd/MoML_1.dtd">
<entity name="ArrayAppend2" class="ptolemy.actor.TypedCompositeActor">
    <property name="_createdBy" class="ptolemy.kernel.attributes.VersionAttribute" value="4.1">
    </property>
    <property name="SDF6" class="ptolemy.domains.sdf.kernel.SDFDirector">
        <property name="iterations" class="ptolemy.data.expr.Parameter" value="1000">
        </property>
        <property name="vectorizationFactor" class="ptolemy.data.expr.Parameter" value="1">
        </property>
        <property name="_location" class="ptolemy.kernel.util.Location" value="96.0, 50.0">
        </property>
        <property name="copernicus_iterations" class="ptolemy.data.expr.Parameter" value="1000">
            <property name="_hideName" class="ptolemy.kernel.util.SingletonAttribute">
            </property>
            <property name="_icon" class="ptolemy.vergil.icon.ValueIcon">
                <property name="_color" class="ptolemy.actor.gui.ColorAttribute" value="{0.0, 0.0, 1.0, 1.0}">
                </property>
            </property>
            <property name="_smallIconDescription" class="ptolemy.kernel.util.SingletonConfigurableAttribute">
                <configure>
      <svg>
        <text x="20" style="font-size:14; font-family:SansSerif; fill:blue" y="20">-P-</text>
      </svg>
    </configure>
            </property>
            <property name="_editorFactory" class="ptolemy.vergil.toolbox.VisibleParameterEditorFactory">
            </property>
            <property name="_location" class="ptolemy.kernel.util.Location" value="{130, 50}">
            </property>
        </property>
    </property>
    <property name="_vergilSize" class="ptolemy.actor.gui.SizeAttribute" value="[604, 454]">
    </property>
    <property name="_vergilLocation" class="ptolemy.actor.gui.LocationAttribute" value="[102, 100]">
    </property>
    <property name="_windowProperties" class="ptolemy.actor.gui.WindowPropertiesAttribute" value="{bounds={237, 210, 819, 572}, maximized=false}">
    </property>
    <property name="_vergilZoomFactor" class="ptolemy.data.expr.ExpertParameter" value="1.0">
    </property>
    <property name="_vergilCenter" class="ptolemy.data.expr.ExpertParameter" value="{302.0, 227.0}">
    </property>
    <entity name="ArrayAppend0" class="ptolemy.actor.lib.ArrayAppend">
        <property name="_location" class="ptolemy.kernel.util.Location" value="312.0, 263.0">
        </property>
    </entity>
    <entity name="Ramp7" class="ptolemy.actor.lib.Ramp">
        <property name="firingCountLimit" class="ptolemy.data.expr.Parameter" value="0">
        </property>
        <property name="init" class="ptolemy.data.expr.Parameter" value="0">
        </property>
        <property name="step" class="ptolemy.actor.parameters.PortParameter" value="1">
        </property>
        <doc>Create a sequence of tokens with increasing value</doc>
        <property name="_location" class="ptolemy.kernel.util.Location" value="70.0, 179.0">
        </property>
    </entity>
    <entity name="SequenceToArray0" class="ptolemy.domains.sdf.lib.SequenceToArray">
        <property name="arrayLength" class="ptolemy.actor.parameters.PortParameter" value="1">
        </property>
        <property name="_location" class="ptolemy.kernel.util.Location" value="208.0, 179.0">
        </property>
    </entity>
    <entity name="Delay2" class="ptolemy.domains.sdf.lib.SampleDelay">
        <property name="initialOutputs" class="ptolemy.data.expr.Parameter" value="{{0}}">
        </property>
        <doc>The sdf delay actor, which behaves as an initial token on an arc.</doc>
        <property name="_location" class="ptolemy.kernel.util.Location" value="189.0, 263.0">
        </property>
    </entity>
    <entity name="Test" class="ptolemy.actor.lib.Test">
        <property name="correctValues" class="ptolemy.data.expr.Parameter" value="{{{0,0}},{{0,0,1}},{{0,0,1,2}},{{0,0,1,2,3}}}">
        </property>
        <property name="tolerance" class="ptolemy.data.expr.Parameter" value="1.0E-9">
        </property>
        <property name="_location" class="ptolemy.kernel.util.Location" value="500.0, 298.0">
        </property>
    </entity>
    <relation name="relation15" class="ptolemy.actor.TypedIORelation">
        <vertex name="vertex1" value="122.0, 185.0">
        </vertex>
    </relation>
    <relation name="relation1" class="ptolemy.actor.TypedIORelation">
        <vertex name="vertex1" value="359.0, 325.0">
        </vertex>
    </relation>
    <relation name="relation" class="ptolemy.actor.TypedIORelation">
    </relation>
    <relation name="relation2" class="ptolemy.actor.TypedIORelation">
    </relation>
    <link port="ArrayAppend0.input" relation="relation"/>
    <link port="ArrayAppend0.input" relation="relation2"/>
    <link port="ArrayAppend0.output" relation="relation1"/>
    <link port="Ramp7.output" relation="relation15"/>
    <link port="SequenceToArray0.input" relation="relation15"/>
    <link port="SequenceToArray0.output" relation="relation2"/>
    <link port="Delay2.input" relation="relation1"/>
    <link port="Delay2.output" relation="relation"/>
    <link port="Test.input" relation="relation1"/>
</entity>
