<?xml version="1.0" standalone="no"?>
<!DOCTYPE entity PUBLIC "-//UC Berkeley//DTD MoML 1//EN"
    "http://ptolemy.eecs.berkeley.edu/xml/dtd/MoML_1.dtd">
<entity name="filterTest1" class="ptolemy.actor.TypedCompositeActor">
    <property name="_createdBy" class="ptolemy.kernel.attributes.VersionAttribute" value="4.1">
    </property>
    <property name="SDF Director" class="ptolemy.domains.sdf.kernel.SDFDirector">
        <property name="allowDisconnectedGraphs" class="ptolemy.data.expr.Parameter" value="true">
        </property>
        <property name="iterations" class="ptolemy.data.expr.Parameter" value="1">
        </property>
        <property name="_location" class="ptolemy.kernel.util.Location" value="[-125.0, -20.0]">
        </property>
    </property>
    <property name="_windowProperties" class="ptolemy.actor.gui.WindowPropertiesAttribute" value="{bounds={22, 102, 956, 466}, maximized=false}">
    </property>
    <property name="_vergilSize" class="ptolemy.actor.gui.SizeAttribute" value="[741, 350]">
    </property>
    <property name="_vergilZoomFactor" class="ptolemy.data.expr.ExpertParameter" value="1.0">
    </property>
    <property name="_vergilCenter" class="ptolemy.data.expr.ExpertParameter" value="{154.2176846590909, 107.1146622474748}">
    </property>
    <property name="N" class="ptolemy.data.expr.Parameter" value="2">
        <property name="_icon" class="ptolemy.vergil.icon.ValueIcon">
            <property name="_color" class="ptolemy.actor.gui.ColorAttribute" value="{0.0, 0.0, 1.0, 1.0}">
            </property>
        </property>
        <property name="_smallIconDescription" class="ptolemy.kernel.util.SingletonConfigurableAttribute">
            <configure>
      <svg>
        <text x="20" style="font-size:14; font-family:SansSerif; fill:blue" y="20">-P-</text>
      </svg>
    </configure>
        </property>
        <property name="_editorFactory" class="ptolemy.vergil.toolbox.VisibleParameterEditorFactory">
        </property>
        <property name="_location" class="ptolemy.kernel.util.Location" value="[15.0, -30.0]">
        </property>
    </property>
    <entity name="Const" class="ptolemy.actor.lib.Const">
        <property name="value" class="ptolemy.data.expr.Parameter" value="function(x:double)x&gt;=5?true:false">
        </property>
        <doc>Create a constant sequence</doc>
        <property name="_icon" class="ptolemy.vergil.icon.BoxedValueIcon">
            <property name="attributeName" class="ptolemy.kernel.util.StringAttribute" value="value">
            </property>
            <property name="displayWidth" class="ptolemy.data.expr.Parameter" value="40">
            </property>
        </property>
        <property name="_location" class="ptolemy.kernel.util.Location" value="[-20.0, 45.0]">
        </property>
        <port name="output" class="ptolemy.actor.TypedIOPort">
            <property name="output"/>
            <property name="_cardinal" class="ptolemy.kernel.util.StringAttribute" value="EAST">
            </property>
        </port>
        <port name="trigger" class="ptolemy.actor.TypedIOPort">
            <property name="input"/>
            <property name="multiport"/>
            <property name="_cardinal" class="ptolemy.kernel.util.StringAttribute" value="WEST">
            </property>
        </port>
    </entity>
    <entity name="Expression2" class="ptolemy.actor.lib.Expression">
        <property name="expression" class="ptolemy.kernel.util.StringAttribute" value="filter(f,in, N)">
        </property>
        <property name="_icon" class="ptolemy.vergil.icon.BoxedValueIcon">
            <property name="attributeName" class="ptolemy.kernel.util.StringAttribute" value="expression">
            </property>
            <property name="displayWidth" class="ptolemy.data.expr.Parameter" value="60">
            </property>
        </property>
        <property name="_location" class="ptolemy.kernel.util.Location" value="[225.0, 95.0]">
        </property>
        <port name="f" class="ptolemy.actor.TypedIOPort">
            <property name="input"/>
        </port>
        <port name="in" class="ptolemy.actor.TypedIOPort">
            <property name="input"/>
            <property name="_type" class="ptolemy.actor.TypeAttribute" value="unknown">
            </property>
        </port>
    </entity>
    <entity name="Const2" class="ptolemy.actor.lib.Const">
        <property name="value" class="ptolemy.data.expr.Parameter" value="{10,2,13,4,7,24}">
        </property>
        <doc>Create a constant sequence</doc>
        <property name="_icon" class="ptolemy.vergil.icon.BoxedValueIcon">
            <property name="attributeName" class="ptolemy.kernel.util.StringAttribute" value="value">
            </property>
            <property name="displayWidth" class="ptolemy.data.expr.Parameter" value="40">
            </property>
        </property>
        <property name="_location" class="ptolemy.kernel.util.Location" value="[-35.0, 140.0]">
        </property>
        <port name="output" class="ptolemy.actor.TypedIOPort">
            <property name="output"/>
            <property name="_cardinal" class="ptolemy.kernel.util.StringAttribute" value="EAST">
            </property>
        </port>
        <port name="trigger" class="ptolemy.actor.TypedIOPort">
            <property name="input"/>
            <property name="multiport"/>
            <property name="_cardinal" class="ptolemy.kernel.util.StringAttribute" value="WEST">
            </property>
        </port>
    </entity>
    <entity name="NonStrictTest" class="ptolemy.actor.lib.NonStrictTest">
        <property name="correctValues" class="ptolemy.data.expr.Parameter" value="{{10, 13}}">
        </property>
        <property name="trainingMode" class="ptolemy.data.expr.Parameter" value="false">
        </property>
        <property name="_location" class="ptolemy.kernel.util.Location" value="{340.0, 60.0}">
        </property>
    </entity>
    <entity name="Expression" class="ptolemy.actor.lib.Expression">
        <property name="expression" class="ptolemy.kernel.util.StringAttribute" value="filter(f,in)">
        </property>
        <property name="_icon" class="ptolemy.vergil.icon.BoxedValueIcon">
            <property name="attributeName" class="ptolemy.kernel.util.StringAttribute" value="expression">
            </property>
            <property name="displayWidth" class="ptolemy.data.expr.Parameter" value="60">
            </property>
        </property>
        <property name="_location" class="ptolemy.kernel.util.Location" value="[205.0, 170.0]">
        </property>
        <port name="f" class="ptolemy.actor.TypedIOPort">
            <property name="input"/>
        </port>
        <port name="in" class="ptolemy.actor.TypedIOPort">
            <property name="input"/>
            <property name="_type" class="ptolemy.actor.TypeAttribute" value="unknown">
            </property>
        </port>
    </entity>
    <entity name="NonStrictTest2" class="ptolemy.actor.lib.NonStrictTest">
        <property name="correctValues" class="ptolemy.data.expr.Parameter" value="{{10, 13, 7, 24}}">
        </property>
        <property name="trainingMode" class="ptolemy.data.expr.Parameter" value="false">
        </property>
        <property name="_location" class="ptolemy.kernel.util.Location" value="{340.0, 185.0}">
        </property>
    </entity>
    <relation name="relation3" class="ptolemy.actor.TypedIORelation">
    </relation>
    <relation name="relation4" class="ptolemy.actor.TypedIORelation">
        <vertex name="vertex1" value="[115.0, 45.0]">
        </vertex>
    </relation>
    <relation name="relation" class="ptolemy.actor.TypedIORelation">
        <vertex name="vertex1" value="{155.0, 105.0}">
        </vertex>
    </relation>
    <relation name="relation2" class="ptolemy.actor.TypedIORelation">
    </relation>
    <link port="Const.output" relation="relation4"/>
    <link port="Expression2.output" relation="relation3"/>
    <link port="Expression2.f" relation="relation4"/>
    <link port="Expression2.in" relation="relation"/>
    <link port="Const2.output" relation="relation"/>
    <link port="NonStrictTest.input" relation="relation3"/>
    <link port="Expression.output" relation="relation2"/>
    <link port="Expression.f" relation="relation4"/>
    <link port="Expression.in" relation="relation"/>
    <link port="NonStrictTest2.input" relation="relation2"/>
</entity>
