<?xml version="1.0" standalone="no"?>
<!DOCTYPE entity PUBLIC "-//UC Berkeley//DTD MoML 1//EN"
    "http://ptolemy.eecs.berkeley.edu/xml/dtd/MoML_1.dtd">
<entity name="BOTTOM" class="ptolemy.domains.fsm.kernel.InterfaceAutomaton">
    <property name="initialStateName" class="ptolemy.kernel.util.StringAttribute" value="0">
    </property>
    <property name="_createdBy" class="ptolemy.kernel.attributes.VersionAttribute" value="3.1-devel">
    </property>
    <property name="_library" class="ptolemy.moml.LibraryAttribute">
        <configure>
            <entity name="state library" class="ptolemy.kernel.CompositeEntity"><entity name="state" class="ptolemy.domains.fsm.kernel.State"></entity></entity>
          </configure>
    </property>
    <property name="_vergilSize" class="ptolemy.actor.gui.SizeAttribute" value="[602, 398]">
    </property>
    <property name="_vergilLocation" class="ptolemy.actor.gui.LocationAttribute" value="[14, 31]">
    </property>
    <property name="_windowProperties" class="ptolemy.actor.gui.WindowPropertiesAttribute" value="{bounds={105, 127, 817, 514}, maximized=false}">
    </property>
    <property name="annotation" class="ptolemy.vergil.kernel.attributes.TextAttribute">
        <property name="text" class="ptolemy.kernel.util.StringAttribute" value="BOTTOM">
        </property>
        <property name="_location" class="ptolemy.kernel.util.Location" value="455.0, 180.0">
        </property>
    </property>
    <property name="_vergilZoomFactor" class="ptolemy.data.expr.ExpertParameter" value="1.0">
    </property>
    <property name="_vergilCenter" class="ptolemy.data.expr.ExpertParameter" value="{301.0, 199.0}">
    </property>
    <port name="fC" class="ptolemy.actor.TypedIOPort">
        <property name="output"/>
        <property name="_location" class="ptolemy.kernel.util.Location" value="500.0, 250.0">
        </property>
    </port>
    <port name="fCR" class="ptolemy.actor.TypedIOPort">
        <property name="input"/>
        <property name="_location" class="ptolemy.kernel.util.Location" value="502.75, 285.0">
        </property>
    </port>
    <port name="hT" class="ptolemy.actor.TypedIOPort">
        <property name="input"/>
        <property name="_location" class="ptolemy.kernel.util.Location" value="375.0, 275.0">
        </property>
    </port>
    <port name="hTT" class="ptolemy.actor.TypedIOPort">
        <property name="output"/>
        <property name="_location" class="ptolemy.kernel.util.Location" value="375.0, 310.0">
        </property>
    </port>
    <port name="hTF" class="ptolemy.actor.TypedIOPort">
        <property name="output"/>
        <property name="_location" class="ptolemy.kernel.util.Location" value="375.0, 345.0">
        </property>
    </port>
    <port name="g" class="ptolemy.actor.TypedIOPort">
        <property name="input"/>
        <property name="_location" class="ptolemy.kernel.util.Location" value="375.0, 200.0">
        </property>
    </port>
    <port name="t" class="ptolemy.actor.TypedIOPort">
        <property name="output"/>
        <property name="_location" class="ptolemy.kernel.util.Location" value="374.62500000000085, 232.5">
        </property>
    </port>
    <entity name="0" class="ptolemy.domains.fsm.kernel.State">
        <property name="_location" class="ptolemy.kernel.util.Location" value="434.3333333333338, 239.1666666666669">
        </property>
    </entity>
    <relation name="relation10" class="ptolemy.domains.fsm.kernel.InterfaceAutomatonTransition">
        <property name="guardExpression" class="ptolemy.kernel.util.StringAttribute" value="g_isPresent">
        </property>
        <property name="exitAngle" class="ptolemy.data.expr.Parameter" value="2.2113108171358835">
        </property>
        <property name="gamma" class="ptolemy.data.expr.Parameter" value="-0.03677613968757671">
        </property>
        <property name="reset" class="ptolemy.data.expr.Parameter" value="false">
        </property>
        <property name="preemptive" class="ptolemy.data.expr.Parameter" value="false">
        </property>
        <property name="label" class="ptolemy.kernel.util.StringAttribute" value="g?">
        </property>
    </relation>
    <relation name="relation11" class="ptolemy.domains.fsm.kernel.InterfaceAutomatonTransition">
        <property name="guardExpression" class="ptolemy.kernel.util.StringAttribute" value="hT_isPresent">
        </property>
        <property name="exitAngle" class="ptolemy.data.expr.Parameter" value="2.3828277731196734">
        </property>
        <property name="gamma" class="ptolemy.data.expr.Parameter" value="-0.009933035657177031">
        </property>
        <property name="reset" class="ptolemy.data.expr.Parameter" value="false">
        </property>
        <property name="preemptive" class="ptolemy.data.expr.Parameter" value="false">
        </property>
        <property name="label" class="ptolemy.kernel.util.StringAttribute" value="hT?">
        </property>
    </relation>
    <relation name="relation" class="ptolemy.domains.fsm.kernel.InterfaceAutomatonTransition">
        <property name="guardExpression" class="ptolemy.kernel.util.StringAttribute" value="fCR_isPresent">
        </property>
        <property name="exitAngle" class="ptolemy.data.expr.Parameter" value="1.9144898013332292">
        </property>
        <property name="gamma" class="ptolemy.data.expr.Parameter" value="0.0017860027711730404">
        </property>
        <property name="reset" class="ptolemy.data.expr.Parameter" value="false">
        </property>
        <property name="preemptive" class="ptolemy.data.expr.Parameter" value="false">
        </property>
        <property name="label" class="ptolemy.kernel.util.StringAttribute" value="fCR?">
        </property>
    </relation>
    <link port="0.incomingPort" relation="relation10"/>
    <link port="0.incomingPort" relation="relation11"/>
    <link port="0.incomingPort" relation="relation"/>
    <link port="0.outgoingPort" relation="relation10"/>
    <link port="0.outgoingPort" relation="relation11"/>
    <link port="0.outgoingPort" relation="relation"/>
</entity>
