<?xml version="1.0" standalone="no"?>
<!DOCTYPE entity PUBLIC "-//UC Berkeley//DTD MoML 1//EN"
    "http://ptolemy.eecs.berkeley.edu/xml/dtd/MoML_1.dtd">
<entity name="JAIImageReader" class="ptolemy.actor.TypedCompositeActor">
    <property name="_windowProperties" class="ptolemy.actor.gui.WindowPropertiesAttribute" value="{bounds={232, 257, 815, 509}}">
    </property>
    <property name="_vergilSize" class="ptolemy.actor.gui.SizeAttribute" value="[600, 400]">
    </property>
    <property name="SDF Director" class="ptolemy.domains.sdf.kernel.SDFDirector">
        <property name="Scheduler" class="ptolemy.domains.sdf.kernel.SDFScheduler">
        </property>
        <property name="allowDisconnectedGraphs" class="ptolemy.data.expr.Parameter" value="false">
        </property>
        <property name="iterations" class="ptolemy.data.expr.Parameter" value="1">
        </property>
        <property name="vectorizationFactor" class="ptolemy.data.expr.Parameter" value="1">
        </property>
        <property name="_location" class="ptolemy.kernel.util.Location" value="65.0, 55.0">
        </property>
    </property>
    <property name="annotation" class="ptolemy.kernel.util.Attribute">
        <property name="_hideName" class="ptolemy.kernel.util.SingletonAttribute">
        </property>
        <property name="_iconDescription" class="ptolemy.kernel.util.SingletonConfigurableAttribute">
            <configure><svg><text x="20" y="20" style="font-size:14; font-family:SansSerif; fill:blue">Read an image and display it.</text></svg></configure>
        </property>
        <property name="_smallIconDescription" class="ptolemy.kernel.util.SingletonConfigurableAttribute">
            <configure>
      <svg>
        <text x="20" style="font-size:14; font-family:SansSerif; fill:blue" y="20">-A-</text>
      </svg>
    </configure>
        </property>
        <property name="_controllerFactory" class="ptolemy.vergil.basic.NodeControllerFactory">
        </property>
        <property name="_editorFactory" class="ptolemy.vergil.toolbox.AnnotationEditorFactory">
        </property>
        <property name="_location" class="ptolemy.kernel.util.Location" value="140.0, 220.0">
        </property>
    </property>
    <entity name="JAIImageReader" class="ptolemy.actor.lib.jai.JAIImageReader">
        <property name="fileOrURL" class="ptolemy.data.expr.FileParameter" value="$CLASSPATH/doc/img/PtolemyII.jpg">
        </property>
        <property name="_location" class="ptolemy.kernel.util.Location" value="165.0, 150.0">
        </property>
        <port name="output" class="ptolemy.actor.TypedIOPort">
            <property name="output"/>
        </port>
        <port name="trigger" class="ptolemy.actor.TypedIOPort">
            <property name="input"/>
            <property name="multiport"/>
        </port>
    </entity>
    <entity name="ImageDisplay" class="ptolemy.actor.lib.image.ImageDisplay">
        <property name="_windowProperties" class="ptolemy.actor.gui.WindowPropertiesAttribute" value="{bounds={276, 200, 728, 624}}">
        </property>
        <property name="_paneSize" class="ptolemy.actor.gui.SizeAttribute" value="[720, 576]">
        </property>
        <property name="_location" class="ptolemy.kernel.util.Location" value="280.0, 190.0">
        </property>
        <port name="input" class="ptolemy.actor.TypedIOPort">
            <property name="input"/>
            <property name="multiport"/>
        </port>
    </entity>
    <relation name="relation" class="ptolemy.actor.TypedIORelation">
    </relation>
    <link port="JAIImageReader.output" relation="relation"/>
    <link port="ImageDisplay.input" relation="relation"/>
</entity>
