<?xml version="1.0" standalone="no"?>
<!DOCTYPE entity PUBLIC "-//UC Berkeley//DTD MoML 1//EN"
    "http://ptolemy.eecs.berkeley.edu/xml/dtd/MoML_1.dtd">
<entity name="SDFCodegen1" class="ptolemy.actor.TypedCompositeActor">
    <property name="_createdBy" class="ptolemy.kernel.attributes.VersionAttribute" value="8.1.devel">
    </property>
    <property name="SDF Director" class="ptolemy.domains.sdf.kernel.SDFDirector">
        <property name="iterations" class="ptolemy.data.expr.Parameter" value="10">
        </property>
        <property name="_location" class="ptolemy.kernel.util.Location" value="{110.0, 115.0}">
        </property>
    </property>
    <property name="_vergilZoomFactor" class="ptolemy.data.expr.ExpertParameter" value="1.9980569503279">
    </property>
    <property name="_vergilCenter" class="ptolemy.data.expr.ExpertParameter" value="{355.5400390624999, 279.8319747681792}">
    </property>
    <property name="_windowProperties" class="ptolemy.actor.gui.WindowPropertiesAttribute" value="{bounds={34, 22, 1406, 878}, maximized=true}">
    </property>
    <property name="_vergilSize" class="ptolemy.actor.gui.SizeAttribute" value="[1193, 771]">
    </property>
    <property name="JavaCodeGenerator" class="ptolemy.codegen.java.kernel.JavaCodeGenerator">
        <property name="_location" class="ptolemy.kernel.util.Location" value="{115.0, 275.0}">
        </property>
    </property>
    <entity name="Ramp" class="ptolemy.actor.lib.Ramp">
        <property name="init" class="ptolemy.data.expr.Parameter" value="1.2">
        </property>
        <doc>Create a sequence of tokens with increasing value</doc>
        <property name="_location" class="ptolemy.kernel.util.Location" value="[275.0, 185.0]">
        </property>
    </entity>
    <entity name="CompositeActor" class="ptolemy.actor.TypedCompositeActor">
        <property name="_location" class="ptolemy.kernel.util.Location" value="{415, 220}">
        </property>
        <property name="_windowProperties" class="ptolemy.actor.gui.WindowPropertiesAttribute" value="{bounds={313, 196, 813, 507}, maximized=false}">
        </property>
        <property name="_vergilSize" class="ptolemy.actor.gui.SizeAttribute" value="[600, 400]">
        </property>
        <property name="_vergilZoomFactor" class="ptolemy.data.expr.ExpertParameter" value="1.0">
        </property>
        <property name="_vergilCenter" class="ptolemy.data.expr.ExpertParameter" value="{300.0, 200.0}">
        </property>
        <port name="out" class="ptolemy.actor.TypedIOPort">
            <property name="output"/>
            <property name="_location" class="ptolemy.kernel.util.Location" value="{770.0, 235.0}">
            </property>
        </port>
        <port name="port" class="ptolemy.actor.TypedIOPort">
            <property name="input"/>
            <property name="multiport"/>
            <property name="_location" class="ptolemy.kernel.util.Location" value="{90.0, 210.0}">
            </property>
            <property name="width" class="ptolemy.data.expr.Parameter" value="-1">
            </property>
        </port>
        <entity name="AddSubtract" class="ptolemy.actor.lib.AddSubtract">
            <property name="_location" class="ptolemy.kernel.util.Location" value="{395.0, 225.0}">
            </property>
        </entity>
        <entity name="Scale" class="ptolemy.actor.lib.Scale">
            <property name="factor" class="ptolemy.data.expr.Parameter" value="3">
            </property>
            <property name="_location" class="ptolemy.kernel.util.Location" value="{265.0, 260.0}">
            </property>
            <property name="_icon" class="ptolemy.vergil.icon.AttributeValueIcon">
                <property name="attributeName" class="ptolemy.kernel.util.StringAttribute" value="factor">
                </property>
            </property>
        </entity>
        <entity name="ElementsToArray" class="ptolemy.actor.lib.ElementsToArray">
            <property name="_location" class="ptolemy.kernel.util.Location" value="{495.0, 235.0}">
            </property>
        </entity>
        <entity name="AddSubtract2" class="ptolemy.actor.lib.AddSubtract">
            <property name="_location" class="ptolemy.kernel.util.Location" value="{405.0, 315.0}">
            </property>
        </entity>
        <entity name="Scale2" class="ptolemy.actor.lib.Scale">
            <property name="factor" class="ptolemy.data.expr.Parameter" value="5">
            </property>
            <property name="_location" class="ptolemy.kernel.util.Location" value="{275.0, 335.0}">
            </property>
            <property name="_icon" class="ptolemy.vergil.icon.AttributeValueIcon">
                <property name="attributeName" class="ptolemy.kernel.util.StringAttribute" value="factor">
                </property>
            </property>
        </entity>
        <entity name="AddSubtract3" class="ptolemy.actor.lib.AddSubtract">
            <property name="_location" class="ptolemy.kernel.util.Location" value="{415.0, 370.0}">
            </property>
        </entity>
        <entity name="Scale3" class="ptolemy.actor.lib.Scale">
            <property name="factor" class="ptolemy.data.expr.Parameter" value="4">
            </property>
            <property name="_location" class="ptolemy.kernel.util.Location" value="{265.0, 415.0}">
            </property>
            <property name="_icon" class="ptolemy.vergil.icon.AttributeValueIcon">
                <property name="attributeName" class="ptolemy.kernel.util.StringAttribute" value="factor">
                </property>
            </property>
        </entity>
        <relation name="relation" class="ptolemy.actor.TypedIORelation">
            <property name="width" class="ptolemy.data.expr.Parameter" value="-1">
                <property name="_editorFactory" class="ptolemy.kernel.util.Attribute">
                </property>
            </property>
            <vertex name="vertex1" value="{185.0, 210.0}">
            </vertex>
        </relation>
        <relation name="relation2" class="ptolemy.actor.TypedIORelation">
        </relation>
        <relation name="relation3" class="ptolemy.actor.TypedIORelation">
        </relation>
        <relation name="relation4" class="ptolemy.actor.TypedIORelation">
        </relation>
        <relation name="relation5" class="ptolemy.actor.TypedIORelation">
        </relation>
        <relation name="relation6" class="ptolemy.actor.TypedIORelation">
        </relation>
        <relation name="relation7" class="ptolemy.actor.TypedIORelation">
        </relation>
        <relation name="relation8" class="ptolemy.actor.TypedIORelation">
        </relation>
        <link port="out" relation="relation6"/>
        <link port="port" relation="relation"/>
        <link port="AddSubtract.plus" relation="relation"/>
        <link port="AddSubtract.plus" relation="relation2"/>
        <link port="AddSubtract.output" relation="relation3"/>
        <link port="Scale.input" relation="relation"/>
        <link port="Scale.output" relation="relation2"/>
        <link port="ElementsToArray.input" relation="relation3"/>
        <link port="ElementsToArray.input" relation="relation5"/>
        <link port="ElementsToArray.input" relation="relation8"/>
        <link port="ElementsToArray.output" relation="relation6"/>
        <link port="AddSubtract2.plus" relation="relation4"/>
        <link port="AddSubtract2.plus" relation="relation"/>
        <link port="AddSubtract2.output" relation="relation5"/>
        <link port="Scale2.input" relation="relation"/>
        <link port="Scale2.output" relation="relation4"/>
        <link port="AddSubtract3.plus" relation="relation7"/>
        <link port="AddSubtract3.output" relation="relation8"/>
        <link port="Scale3.input" relation="relation"/>
        <link port="Scale3.output" relation="relation7"/>
    </entity>
    <entity name="Ramp2" class="ptolemy.actor.lib.Ramp">
        <property name="init" class="ptolemy.data.expr.Parameter" value="1.3">
        </property>
        <property name="step" class="ptolemy.actor.parameters.PortParameter" value="2">
        </property>
        <doc>Create a sequence of tokens with increasing value</doc>
        <property name="_location" class="ptolemy.kernel.util.Location" value="[277.5390625, 260.78125]">
        </property>
    </entity>
    <entity name="Test" class="ptolemy.actor.lib.Test">
        <property name="correctValues" class="ptolemy.data.expr.Parameter" value="{{{4.8, 7.2, 4.8}}, {{8.8, 13.2, 8.8}}, {{12.8, 19.2, 12.8}}, {{16.8, 25.2, 16.8}}, {{20.8, 31.2, 20.8}}, {{24.8, 37.2, 24.8}}, {{28.8, 43.2, 28.8}}, {{32.8, 49.2, 32.8}}, {{36.8, 55.2, 36.8}}, {{40.8, 61.2, 40.8}}}">
        </property>
        <property name="trainingMode" class="ptolemy.actor.parameters.SharedParameter" value="false">
        </property>
        <property name="_location" class="ptolemy.kernel.util.Location" value="[520.0, 220.0]">
        </property>
    </entity>
    <relation name="relation" class="ptolemy.actor.TypedIORelation">
    </relation>
    <relation name="relation2" class="ptolemy.actor.TypedIORelation">
    </relation>
    <relation name="relation3" class="ptolemy.actor.TypedIORelation">
    </relation>
    <link port="Ramp.output" relation="relation"/>
    <link port="CompositeActor.out" relation="relation3"/>
    <link port="CompositeActor.port" relation="relation"/>
    <link port="CompositeActor.port" relation="relation2"/>
    <link port="Ramp2.output" relation="relation2"/>
    <link port="Test.input" relation="relation3"/>
</entity>
