<?xml version="1.0" standalone="no"?>
<!DOCTYPE entity PUBLIC "-//UC Berkeley//DTD MoML 1//EN"
    "http://ptolemy.eecs.berkeley.edu/xml/dtd/MoML_1.dtd">
<entity name="JAIBorder" class="ptolemy.actor.TypedCompositeActor">
    <property name="SDF Director" class="ptolemy.domains.sdf.kernel.SDFDirector">
        <property name="Scheduler" class="ptolemy.domains.sdf.kernel.SDFScheduler">
        </property>
        <property name="allowDisconnectedGraphs" class="ptolemy.data.expr.Parameter" value="false">
        </property>
        <property name="iterations" class="ptolemy.data.expr.Parameter" value="1">
        </property>
        <property name="vectorizationFactor" class="ptolemy.data.expr.Parameter" value="1">
        </property>
        <property name="_location" class="ptolemy.kernel.util.Location" value="135.0, 50.0">
        </property>
    </property>
    <property name="_windowProperties" class="ptolemy.actor.gui.WindowPropertiesAttribute" value="{bounds={232, 257, 815, 509}}">
    </property>
    <property name="_vergilSize" class="ptolemy.actor.gui.SizeAttribute" value="[600, 400]">
    </property>
    <property name="annotation" class="ptolemy.kernel.util.Attribute">
        <property name="_hideName" class="ptolemy.kernel.util.SingletonAttribute">
        </property>
        <property name="_iconDescription" class="ptolemy.kernel.util.SingletonConfigurableAttribute">
            <configure><svg><text x="20" y="20" style="font-size:14; font-family:SansSerif; fill:blue">Adds a black border of 10 pixels
on all sides of the image.</text></svg></configure>
        </property>
        <property name="_smallIconDescription" class="ptolemy.kernel.util.SingletonConfigurableAttribute">
            <configure>
      <svg>
        <text x="20" style="font-size:14; font-family:SansSerif; fill:blue" y="20">-A-</text>
      </svg>
    </configure>
        </property>
        <property name="_controllerFactory" class="ptolemy.vergil.basic.NodeControllerFactory">
        </property>
        <property name="_editorFactory" class="ptolemy.vergil.toolbox.AnnotationEditorFactory">
        </property>
        <property name="_location" class="ptolemy.kernel.util.Location" value="70.0, 270.0">
        </property>
    </property>
    <entity name="JAIBorder" class="ptolemy.actor.lib.jai.JAIBorder">
        <property name="leftPadding" class="ptolemy.data.expr.Parameter" value="10">
        </property>
        <property name="rightPadding" class="ptolemy.data.expr.Parameter" value="10">
        </property>
        <property name="topPadding" class="ptolemy.data.expr.Parameter" value="10">
        </property>
        <property name="bottomPadding" class="ptolemy.data.expr.Parameter" value="10">
        </property>
        <property name="borderType" class="ptolemy.kernel.util.StringAttribute" value="Zero">
            <property name="style" class="ptolemy.actor.gui.style.ChoiceStyle">
                <property name="Constant" class="ptolemy.kernel.util.StringAttribute" value="Constant">
                </property>
                <property name="Copy" class="ptolemy.kernel.util.StringAttribute" value="Copy">
                </property>
                <property name="Reflect" class="ptolemy.kernel.util.StringAttribute" value="Reflect">
                </property>
                <property name="Wrap" class="ptolemy.kernel.util.StringAttribute" value="Wrap">
                </property>
                <property name="Zero" class="ptolemy.kernel.util.StringAttribute" value="Zero">
                </property>
            </property>
        </property>
        <property name="constants" class="ptolemy.data.expr.Parameter" value="{0.0}">
        </property>
        <property name="_location" class="ptolemy.kernel.util.Location" value="205.0, 205.0">
        </property>
        <port name="input" class="ptolemy.actor.TypedIOPort">
            <property name="input"/>
        </port>
        <port name="output" class="ptolemy.actor.TypedIOPort">
            <property name="output"/>
        </port>
    </entity>
    <entity name="JAIImageReader" class="ptolemy.actor.lib.jai.JAIImageReader">
        <property name="fileOrURL" class="ptolemy.data.expr.FileParameter" value="$CLASSPATH/doc/img/PtolemyII.jpg">
        </property>
        <property name="_location" class="ptolemy.kernel.util.Location" value="90.0, 170.0">
        </property>
        <port name="output" class="ptolemy.actor.TypedIOPort">
            <property name="output"/>
        </port>
        <port name="trigger" class="ptolemy.actor.TypedIOPort">
            <property name="input"/>
            <property name="multiport"/>
        </port>
    </entity>
    <entity name="ImageDisplay" class="ptolemy.actor.lib.image.ImageDisplay">
        <property name="_windowProperties" class="ptolemy.actor.gui.WindowPropertiesAttribute" value="{bounds={266, 190, 748, 644}}">
        </property>
        <property name="_paneSize" class="ptolemy.actor.gui.SizeAttribute" value="[740, 596]">
        </property>
        <property name="_location" class="ptolemy.kernel.util.Location" value="335.0, 240.0">
        </property>
        <port name="input" class="ptolemy.actor.TypedIOPort">
            <property name="input"/>
            <property name="multiport"/>
        </port>
    </entity>
    <relation name="relation" class="ptolemy.actor.TypedIORelation">
    </relation>
    <relation name="relation2" class="ptolemy.actor.TypedIORelation">
    </relation>
    <link port="JAIBorder.input" relation="relation"/>
    <link port="JAIBorder.output" relation="relation2"/>
    <link port="JAIImageReader.output" relation="relation"/>
    <link port="ImageDisplay.input" relation="relation2"/>
</entity>
